{
  "operator": "MLawrence",
  "section": "",
  "text": "",
  "retrieved": "2026-09-22",
  "id": "az-tucson-o12268-generation",
  "mechanism": "generation",
  "summary": "Backup generation must be Tier IV or gas/dual-fuel with battery-first backup; no load shifting; generator testing limited to weekdays 9 a.m. to 5 p.m.",
  "notes": "",
  "confidence_note": "Figures are from the May 28 2026 proposal fact sheet. The adopted ordinance (O12268) PDF is a scan with no text layer and has not been read; the adopted page describes 'enhanced separation distances' without figures. Confirm against the adopted text after OCR.",
  "tags": [
    "generators",
    "tier-iv",
    "battery-first",
    "testing-hours"
  ],
  "jurisdiction": "us-az-tucson",
  "instrument": "Tucson Ordinance O12268, Large-Scale Data Centers UDC amendment",
  "status": "adopted",
  "effective": "2026-09-04",
  "freshness": "LIVE",
  "source": {
    "kind": "primary",
    "citation": "City of Tucson, Large-Scale Data Centers Unified Development Code Amendment fact sheet, May 28 2026 (proposal stage); City of Tucson Regulations for Large-Scale Data Centers page",
    "url": "https://www.tucsonaz.gov/files/sharedassets/public/v/1/pdsd/documents/data-centers/large-scale-data-centers-code-amendment-fact-sheet_05.28.26.pdf"
  },
  "origin": "RELAYED",
  "entry_state": "NOT_CHECKED"
}