{
 "operator": "MLawrence",
 "section": "",
 "text": "",
 "retrieved": "2026-09-29",
 "id": "il-chicago-moratorium-proposal",
 "jurisdiction": "us-il-chicago",
 "instrument": "Mayoral proposal for a citywide data center moratorium",
 "mechanism": "use-permission",
 "status": "proposed",
 "effective": "",
 "freshness": "LIVE",
 "summary": "Ordinance introduced Sept 23, 2026 by Mayor Johnson and Ald. Robinson (4th), co-sponsored by Ald. Hadden (49th) and Manaa-Hoppenworth (48th), to pause new data centers and the material expansion of existing ones for 12 months while the Data Centers Task Force develops regulations. Not yet adopted.",
 "notes": "Proposed September 23, 2026.",
 "confidence_note": "Relayed; no ordinance text read and no council action taken.",
 "source": {
  "kind": "secondary",
  "citation": "City of Chicago press release (search excerpt; site blocks automated reading); Block Club Chicago and Chicago Tribune, Sept 23-24, 2026"
 },
 "tags": [
  "proposed",
  "one-year",
  "citywide"
 ],
 "origin": "RELAYED",
 "entry_state": "NOT_CHECKED"
}