{
  "operator": "MLawrence",
  "section": "",
  "text": "",
  "retrieved": "2026-09-23",
  "id": "ut-box-elder-stratos-approval",
  "jurisdiction": "us-ut-box-elder-county",
  "instrument": "Box Elder County Commission approval, Stratos (O'Leary Digital)",
  "mechanism": "use-permission",
  "status": "adopted",
  "effective": "2026-05-04",
  "summary": "Box Elder County commissioners approved the Stratos data center project unanimously on May 4, 2026. The site is unincorporated land in Hansel Valley north of the Great Salt Lake, near Snowville.",
  "notes": "Original proposal reported at roughly 40,000 acres and 7.5 to 9 GW.",
  "confidence_note": "Relayed; the commission record has not been read.",
  "tags": [
    "stratos",
    "oleary",
    "unincorporated"
  ],
  "freshness": "LIVE",
  "source": {
    "kind": "secondary",
    "citation": "Utah news coverage, June 2026; Salt Lake Tribune, Deseret News and KSL reporting on the Stratos project"
  },
  "origin": "RELAYED",
  "entry_state": "NOT_CHECKED"
}