{
  "id": "ar-pulaski-county-moratorium-may-2026",
  "jurisdiction": "us-ar-pulaski-county",
  "instrument": "Pulaski County 12-month moratorium on new data center permits (May 2026)",
  "mechanism": "use-permission",
  "status": "adopted",
  "effective": "",
  "summary": "Quorum Court adopted a one-year moratorium on new data center permits in May 2026.",
  "origin": "RELAYED",
  "entry_state": "NOT_CHECKED",
  "freshness": "WARM",
  "source": {
    "kind": "secondary",
    "citation": "Arkansas Democrat-Gazette, May 26, 2026"
  },
  "notes": "",
  "confidence_note": "Primary instrument not read.",
  "tags": [
    "moratorium"
  ],
  "section": "",
  "text": "",
  "retrieved": "2026-09-27",
  "operator": "MLawrence"
}