{
  "operator": "MLawrence",
  "section": "",
  "text": "",
  "retrieved": "2026-09-23",
  "id": "il-normal-moratorium-extension",
  "jurisdiction": "us-il-normal",
  "instrument": "Town of Normal data center moratorium extension",
  "mechanism": "use-permission",
  "status": "adopted",
  "effective": "2026-09-21",
  "freshness": "LIVE",
  "summary": "The council voted 6-1 on September 21, 2026 to extend the data center moratorium to May 31, 2027, to await state data center legislation.",
  "notes": "SUPERSEDES the prior proposed-status entry. Staff reported reviewing other jurisdictions' ordinances, including Aurora and Champaign County, while drafting.",
  "confidence_note": "Relayed; the adopted extension has not been read.",
  "source": {
    "kind": "secondary",
    "citation": "Central Illinois reporting, September 22 2026"
  },
  "tags": [
    "extension",
    "2027-05-31",
    "state-legislation"
  ],
  "origin": "RELAYED",
  "entry_state": "NOT_CHECKED"
}